{
  "version": 1,
  "updatedAt": "2026-10-13",
  "contact": {
    "issues": "https://github.com/ElgardeCom/elgarde/issues",
    "email": "support@elgarde.com"
  },
  "text": {
    "en": "Each entry describes a known weak point of a model, engine or gearbox, based on published sources. It is not a statement about any individual car and not a diagnosis. An entry does not mean that a given car has the defect; the absence of an entry does not mean that a car is sound. Prevalence figures are estimates for the stated population and method, with their biases, and cannot be applied to a single car. The data is provided as is, without warranty (CC-BY-4.0, section 5); it is not a certified, mechanical or legal inspection. Naming a manufacturer or its product is not an assessment of that manufacturer; source links show where each fact comes from. To report an error, open an issue at github.com/ElgardeCom/elgarde or write to support@elgarde.com. We correct mistakes.",
    "pt": "Cada entrada descreve um ponto fraco conhecido de um modelo, motor ou caixa de velocidades, com base em fontes publicadas. Não é uma afirmação sobre um automóvel concreto nem um diagnóstico. A existência de uma entrada não significa que um determinado automóvel tenha o defeito; a ausência de uma entrada não significa que o automóvel esteja em bom estado. Os números de prevalência são estimativas para a população e o método indicados, com os seus enviesamentos, e não podem ser aplicados a um automóvel isolado. Os dados são fornecidos tal como estão, sem garantia (CC-BY-4.0, secção 5); não constituem uma inspeção certificada, mecânica ou jurídica. A menção de um fabricante ou de um produto seu não é uma avaliação desse fabricante; as ligações às fontes indicam de onde vem cada facto. Para comunicar um erro, abra uma issue em github.com/ElgardeCom/elgarde ou escreva para support@elgarde.com. Corrigimos os erros.",
    "ru": "Каждая запись описывает известное слабое место модели, двигателя или КПП по опубликованным источникам. Это не утверждение о конкретном автомобиле и не диагноз. Наличие записи не означает, что дефект есть у данной машины; отсутствие записи не означает, что машина исправна. Цифры распространённости — оценки для указанной выборки и методики, со своими смещениями; переносить их на отдельную машину нельзя. Данные предоставляются «как есть», без гарантий (CC-BY-4.0, раздел 5); это не сертифицированная, не техническая и не юридическая экспертиза. Упоминание производителя или его продукта не является оценкой производителя; ссылки на источники показывают, откуда взят каждый факт. Чтобы сообщить об ошибке, создайте issue на github.com/ElgardeCom/elgarde или напишите на support@elgarde.com. Ошибки мы исправляем.",
    "uk": "Кожен запис описує відоме слабке місце моделі, двигуна або КПП за опублікованими джерелами. Це не твердження про конкретний автомобіль і не діагноз. Наявність запису не означає, що дефект є в цієї машини; відсутність запису не означає, що машина справна. Показники поширеності — оцінки для зазначеної вибірки та методики, з їхніми зміщеннями; переносити їх на окрему машину не можна. Дані надаються «як є», без гарантій (CC-BY-4.0, розділ 5); це не сертифікована, не технічна і не юридична експертиза. Згадка виробника або його продукту не є оцінкою виробника; посилання на джерела показують, звідки взято кожен факт. Щоб повідомити про помилку, створіть issue на github.com/ElgardeCom/elgarde або напишіть на support@elgarde.com. Помилки ми виправляємо.",
    "fr": "Chaque fiche décrit un point faible connu d'un modèle, d'un moteur ou d'une boîte de vitesses, d'après des sources publiées. Ce n'est ni une affirmation sur un véhicule particulier ni un diagnostic. La présence d'une fiche ne signifie pas qu'un véhicule donné présente le défaut ; l'absence de fiche ne signifie pas qu'un véhicule est sain. Les chiffres de fréquence sont des estimations pour la population et la méthode indiquées, avec leurs biais, et ne s'appliquent pas à un véhicule isolé. Les données sont fournies en l'état, sans garantie (CC-BY-4.0, section 5) ; elles ne constituent pas une expertise certifiée, mécanique ou juridique. La mention d'un constructeur ou de l'un de ses produits n'est pas une appréciation de ce constructeur ; les liens vers les sources indiquent l'origine de chaque fait. Pour signaler une erreur, ouvrez une issue sur github.com/ElgardeCom/elgarde ou écrivez à support@elgarde.com. Nous corrigeons les erreurs."
  }
}
